,input,output
1157,he's an adult and would learn from the experience there's no real danger i just dont like peeps using drugs they dont need but no comment,human
1158,hey there's veggie pizza,human
1159,yun buying but school got offer   plus only,human
1160,you sure your neighbors didnt pick it up,human
1161,k i will sent it again,human
1162,free entry in   a wkly comp to win fa cup final tkts  st may   text fa to   to receive entry question std txt rate t c's apply  over 's,spam
1163,"new theory argument wins d situation, but loses the person so dont argue with ur friends just kick them amp say, i'm always correct",human
1164,well im computerless time to make some oreo truffles,human
1165,"haha yeah i see that now, be there in a sec",human
1166,i am not having her number sir,human
1167,lol now i'm after that hot air balloon,human
1168,ok now i am in bus if i come soon i will come otherwise tomorrow,human
1169,msgs r not time pass they silently say that i am thinking of u right now and also making u think of me at least   a moment gd nt swt drms shesil,human
1170,"yeah, we can probably swing by once my roommate finishes up with his girl",human
1171,"got what it takes   take part in the wrc rally in oz u can with lucozade energy text rally le to    p , see packs or lucozade co uk wrc itcould be u",spam
1172,happy new years melody,human
1173,ìï dun need to pick ur gf,human
1174,yay you better not have told that to   other girls either,human
1175,horrible u eat macs eat until u forgot abt me already rite u take so long   reply i thk it's more toot than b  so b prepared now wat shall i eat,human
1176,"did he say how fantastic i am by any chance, or anything need a bigger life lift as losing the will   live, do you think i would be the first person   die from n v q",human
1177,just nw i came to hme da,human
1178,"i'm outside islands, head towards hard rock and you'll run into me",human
1179,to day class is there are no class,human
1180,i'm in chennai velachery,human
1181,you flippin your shit yet,human
1182,"k give me a sec, breaking a lt gt at cstore",human
1183,am i that much bad to avoid like this,human
1184,"yo, you around just got my car back",human
1185,annoying isn't it,human
1186,"goodmorning, today i am late for lt gt min",human
1187,there's no point hangin on to mr not right if he's not makin u happy,human
1188,all will come alive better correct any good looking figure there itself,human
1189,in that case i guess i'll see you at campus lodge,human
1190,we're done,human
1191,come to my home for one last time i wont do anything trust me,human
1192,i was up all night too worrying about this appt it's a shame we missed a girls night out with quizzes popcorn and you doing my hair,human
1193,sex up ur mobile with a free sexy pic of jordan just text babe to   then every wk get a sexy celeb pocketbabe co uk   more pics   å£  wk  ,spam
1194,ok c ya,human
1195,you have   new voicemail please call  ,spam
1196,what he said is not the matter my mind saying some other matter is there,human
1197,he also knows about lunch menu only da i know,human
1198,"al he does is moan at me if n e thin goes wrong its my fault al de arguments r my fault fed up of him of himso y bother hav  go, thanx xx",human
1199,neft transaction with reference number lt gt for rs lt decimal gt has been credited to the beneficiary account on lt gt at lt time gt lt gt,human
1200,otherwise had part time job na tuition,human
1201,i know she called me,human
1202,"me also da, i feel yesterday night wait til  day night dear",human
1203,thanks for understanding i've been trying to tell sura that,human
1204,win a year supply of cds   a store of ur choice worth å£  enter our å£  weekly draw txt music to   ts cs www ldew com subs   win ppmx ,spam
1205,the whole car appreciated the last two dad and are having a map reading semi argument but apart from that things are going ok p,human
1206,"as a sim subscriber, you are selected to receive a bonus get it delivered to your door, txt the word ok to no   to claim  p msg, exp  apr",spam
1207,i need you to be in my strong arms,human
1208,also maaaan are you missing out,human
1209,his bday real is in april,human
1210,guessin you ain't gonna be here before  ,human
1211,ok then i will come to ur home after half an hour,human
1212,"yo, the game almost over want to go to walmart soon",human
1213,"yeah, probably but not sure ilol let u know, but personally i wuldnt bother, then again if ur goin to then i mite as well",human
1214,i'll text now all creepy like so he won't think that we forgot,human
1215,"that would be good û_ i'll phone you tomo lunchtime, shall i, to organise something",human
1216,you have   new voicemail please call  ,spam
1217,"damn, can you make it tonight or do you want to just wait til tomorrow",human
1218,k k i'm also fine when will you complete the course,human
1219,"true it is passable and if you get a high score and apply for phd, you get  years of salary so it makes life easier",human
1220,no   nokia tone   ur mob every week just txt nok to    st tone free so get txtin now and tell ur friends  p tone   reply hl  info,spam
1221,prakesh is there know,human
1222,teach me apps da when you come to college,human
1223,rofl betta invest in some anti aging products,human
1224,you are a winner u have been specially selected   receive å£  cash or a   holiday flights inc speak to a live operator   claim  ,spam
1225,"sir, you will receive the account no another  hr time sorry for the delay",human
1226,reply with your name and address and you will receive by post a weeks completely free accommodation at various global locations www phb  com ph  p,spam
1227,so ì_'ll be submitting da project tmr rite,human
1228,free entry into our å£  weekly comp just send the word enter to   now   t c www textcomp com cust care  ,spam
1229,jus ans me lar u'll noe later,human
1230,i want to send something that can sell fast lt gt k is not easy money,human
1231,have got few things to do may be in pub later,human
1232, 's finish meeting call me,human
1233,lol ok i'll snatch her purse too,human
1234,"\hello drivby  quit edrunk sorry iff pthis makes no senrd dnot no how dancce   drum n basq ihave fun  nhite x ros xxxxxxx\""""",human
1235,your opinion about me   over   jada   kusruthi   lovable   silent   spl character   not matured   stylish   simple pls reply,human
1236,how much are we getting,human
1237,is ur paper in e morn or aft tmr,human
1238,"dear relieved of westonzoyland, all going to plan this end too",human
1239,hope you are having a great new semester do wish you the very best you are made for greatness,human
1240,oh yes i can speak txt   u no hmm did u get email,human
1241,"i want to show you the world, princess how about europe",human
1242,nobody can decide where to eat and dad wants chinese,human
1243,no shoot me i'm in the docs waiting room,human
1244,now i'm going out   dinner soon,human
1245,hello which the site to download songs its urgent pls,human
1246,"i do know what u mean, is the king of not havin credit i'm goin bed now night night sweet only more sleep",human
1247,horrible gal me in sch doing some stuff how come u got mc,human
1248,"hi hun im not comin  nite tell every  im sorry   me, hope u ava goodtime oli rang melnite ifink it mite b sorted,but il explain everythin on mon l rs x",human
1249,"i call you later, don't have network if urgnt, sms me",human
1250,ummmmmaah many many happy returns of d day my dear sweet heart happy birthday dear,human
1251,please call   immediately as there is an urgent message waiting for you,spam
1252,yeah like if it goes like it did with my friends imma flip my shit in like half an hour,human
1253,mum say we wan to go then go then she can shun bian watch da glass exhibition,human
1254,what your plan for pongal,human
1255,just wait till end of march when el nino gets himself oh,human
1256,"not yet chikku going to room nw, i'm in bus",human
1257,am also doing in cbe only but have to pay,human
1258,honey boo i'm missing u,human
1259,"we have sent jd for customer service cum accounts executive to ur mail id, for details contact us",human
1260,"yo, i'm at my parents' gettin cash good news we picked up a downstem",human
1261,"thank you so much when we skyped wit kz and sura, we didnt get the pleasure of your company hope you are good we've given you ultimatum oh we are countin down to aburo enjoy",human
1262,"hungry gay guys feeling hungry and up   it, now call   just  p min to stop texts call    p min",spam
1263,ok no wahala just remember that a friend in need,human
1264,i will see in half an hour,human
1265,"im in inperialmusic listening the weirdest track ever byåóleafcutter johnåó sounds like insects being molested someone plumbing,remixed by evil men on acid",human
1266,\hey sorry i didntgive ya a a bellearlier hunny,human
1267,seriously tell her those exact words right now,human
1268,can u get   phone now i wanna chat   set up meet call me now on   u can cum here  moro luv jane xx callså£  minmoremobsemspobox po wa,spam
1269,"tee hee off to lecture, cheery bye bye",human
1270,"sorry chikku, my cell got some problem thts y i was nt able to reply u or msg u",human
1271,if you still havent collected the dough pls let me know so i can go to the place i sent it to get the control number,human
1272,ok,human
1273,network operator the service is free for t c's visit   biz,spam
1274,let me know how to contact you i've you settled in a room lets know you are ok,human
1275,wot u up   u weirdo,human
1276,can do lor,human
1277,dont put your phone on silent mode ok,human
1278,can i meet ì_ at   as   where depends on where ì_ wan   in lor,human
1279,waiting   my tv show   start lor u leh still busy doing ur report,human
1280,oh ho is this the first time u use these type of words,human
1281,am i the only one who doesn't stalk profiles,human
1282,"ever green quote ever told by jerry in cartoon \a person who irritates u always is the one who loves u vry much but fails to express it gud nyt""",human
1283,yes i thought so thanks,human
1284,but if she s drinkin i'm ok,human
1285,"just wondering, the others just took off",human
1286,"night has ended for another day, morning has come in a special way may you smile like the sunny rays and leaves your worries at the blue blue bay gud mrng",human
1287,"what do you do, my dog must i always wait till the end of your day to have word from you did you run out of time on your cell already",human
1288,happy new year to u too,human
1289,"hey great deal farm tour  am to  pm   pax,   deposit by   may",human
1290,eat jap done oso aft ur lect wat ìï got lect at   rite,human
1291,"hey babe i saw you came online for a second and then you disappeared, what happened",human
1292,da my birthdate in certificate is in april but real date is today but dont publish it i shall give you a special treat if you keep the secret any way thanks for the wishes,human
1293,happy birthday may all ur dreams come true,human
1294,aiyah u did ok already lar e nydc at wheellock,human
1295,tell her i said eat shit,human
1296,sure i am driving but will reach my destination soon,human
1297,"k so am i, how much for an  th fifty",human
1298,your daily text from me ûò a favour this time,human
1299,great to hear you are settling well so what's happenin wit ola,human
1300,those cocksuckers if it makes you feel better ipads are worthless garbage novelty items and you should feel bad for even wanting one,human
1301,i tot u reach liao he said t shirt,human
1302,"fran i decided   go n e way im completely broke an knackered i got up bout   c u  mrw love janx p s this is my dads fone, no credit",human
1303,i cant pick the phone right now pls send a message,human
1304,your right i'll make the appointment right now,human
1305,designation is software developer and may be she get chennai,human
1306,enjoy the jamster videosound gold club with your credits for   new videosounds   logos musicnews get more fun from jamster co uk   only help call  ,spam
1307,"get   lions england tone, reply lionm   mono or lionp   poly   more go   www ringtones co uk, the original n best tones  gbp network operator rates apply",spam
1308,i jokin oni lar ìï busy then i wun disturb ì_,human
1309,"ok, be careful don't text and drive",human
1310,"i ll always be there, even if its just in spirit i ll get a bb soon just trying to be sure i need it",human
1311,u r too much close to my heart if u go away i will be shattered plz stay with me,human
1312,i love u   babe r u sure everything is alrite is he being an idiot txt bak girlie,human
1313,how abt making some of the pics bigger,human
1314,got but got   colours lor one colour is quite light n e other is darker lor actually i'm done she's styling my hair now,human
1315,"whenevr ur sad, whenevr ur gray, remembr im here   listn   watevr u wanna say, jus walk wid me a little while, amp i promise i'll bring back ur smile",human
1316,why nothing ok anyway give me treat,human
1317,"win the newest ûïharry potter and the order of the phoenix book   reply harry, answer   questions chance to be the first among readers",spam
1318,ok,human
1319,correct so how was work today,human
1320,"just sent again do you scream and moan in bed, princess",human
1321,"i wake up long ago already dunno, what other thing",human
1322,oh just getting even with u u,human
1323,i thk   shd be ok he said plus minus   did ì_ leave a line in between paragraphs,human
1324,can you call me plz your number shows out of coveragd area i have urgnt call in vasai amp have to reach before  'o clock so call me plz,human
1325,yeah jay's sort of a fucking retard,human
1326,"sorry, was in the bathroom, sup",human
1327,ur balance is now å£  ur next question is who sang 'uptown girl' in the  's   answer txt ur answer to   good luck,spam
1328,my exam is for february   wish you a great day,human
1329,i dont know what to do to come out of this so only am ask questions like this dont mistake me,human
1330,"aight no rush, i'll ask jay",human
1331,good morning plz call me sir,human
1332,it's ok lar u sleep early too nite,human
1333,"oh icic k lor, den meet other day",human
1334,"oh a half hour is much longer in syria than canada, eh wow you must get so much more work done in a day than us with all that extra time grins",human
1335,"sometimes we put walls around our hearts,not just to be safe from getting hurt but to find out who cares enough to break the walls amp get closer goodnoon",human
1336,"sweet, we may or may not go to  u to meet carlos so gauge patty's interest in that",human
1337,then she buying today ìï no need to c meh,human
1338,aight sorry i take ten years to shower what's the plan,human
1339,every monday nxt week vl be completing,human
1340,might ax well im there,human
1341,just chill for another  hrs if you could sleep the pain is not a surgical emergency so see how it unfolds okay,human
1342,yeah i'll try to scrounge something up,human
1343,crazy ar he's married ìï like gd looking guys not me my frens like say he's korean leona's fave but i dun thk he is aft some thinking mayb most prob i'll go,human
1344,were somewhere on fredericksburg,human
1345,que pases un buen tiempo or something like that,human
1346,is it ok if i stay the night here xavier has a sleeping bag and i'm getting tired,human
1347,she doesnt need any test,human
1348,"nothing much, chillin at home any super bowl plan",human
1349,"free day sexy st george's day pic of jordan txt pic to   dont miss out, then every wk a saucy celeb   more pics c pocketbabe co uk   å£  wk",spam
1350,bugis oso near wat,human
1351,yo theres no class tmrw right,human
1352,let ur heart be ur compass ur mind ur map ur soul ur guide and u will never loose in world gnun sent via way sms com,human
1353,"goodnight, sleep well da please take care pa please",human
1354,baaaaabe i misss youuuuu where are you i have to go and teach my class at  ,human
1355,convey my regards to him,human
1356,u ned to convince him tht its not possible witot hurting his feeling its the main,human
1357,"good afternoon loverboy how goes you day any luck come your way i think of you, sweetie and send my love across the sea to make you smile and happy",human
1358,if i start sending blackberry torch to nigeria will you find buyer for me like  a month and tell dad not to buy bb from anyone oh,human
1359,"lt gt of pple marry with their lovers becz they hav gud undrstndng dat avoids problems i sent dis   u, u wil get gud news on friday by d person you like and tomorrow will be the best day of your life dont break this chain if you break you will suffer send this to lt gt frnds in lt gt mins whn u read",human
1360,yo dude guess who just got arrested the other day,human
1361,shuhui say change   suntec steamboat u noe where where r u now,human
1362,what does the dance river do,human
1363,"yetunde, i'm sorry but moji and i seem too busy to be able to go shopping can you just please find some other way to get what you wanted us to get please forgive me you can reply free via yahoo messenger",human
1364,hey i will be really pretty late you want to go for the lesson first i will join you i'm only reaching tp mrt,human
1365,"hot live fantasies call now   just  p per min ntt ltd, po box   croydon cr   wb   k",spam
1366,bbq this sat at mine from  ish ur welcome   come,human
1367,"i don't know, same thing that's wrong everyso often, he panicks starts goin on bout not bein good enough û_",human
1368,alright i'm out have a good night,human
1369,did you try making another butt,human
1370,hope you are feeling great pls fill me in abiola,human
1371,i though we shd go out n have some fun so bar in town or something ûò sound ok,human
1372,"  go to write msg   put on dictionary mode   cover the screen with hand,   press lt gt   gently remove ur hand its interesting",human
1373,"bears pic nick, and tom, pete and dick in fact, all types try gay chat with photo upload call    p min   stop texts call  ",spam
1374,"  new mobiles from  , must go txt nokia to no   collect yours today from only å£  www   tc biz  optout    gbp mtmsg  txtauction",spam
1375,we're finally ready fyi,human
1376,auntie huai juan never pick up her phone,human
1377,double mins double txt     price linerental on latest orange bluetooth mobiles call mobileupd  for the very latest offers   or call optout lf ,spam
1378,"ya tel, wats ur problem",human
1379,no   nokia tone   ur mob every week just txt nok to    st tone free so get txtin now and tell ur friends  p tone   reply hl  info,spam
1380,i dnt wnt to tlk wid u,human
1381,"we spend our days waiting for the ideal path to appear in front of us but what we forget is \paths are made by walking not by waiting \"" goodnight """,human
1382,its ok my arm is feeling weak cuz i got a shot so we can go another time,human
1383,please reserve ticket on saturday eve from chennai to thirunelvali and again from tirunelvali to chennai on sunday eve i already see in net no ticket available i want to book ticket through tackle,human
1384,"storming msg wen u lift d phne, u say \hello\"" do u knw wt is d real meaning of hello it's d name of a girl yes and u knw who is dat girl \""margaret hello\"" she is d girlfrnd f grahmbell who invnted telphone moral one can  get d name of a person",human
1385,that's ok i popped in to ask bout something and she said you'd been in are you around tonght wen this girl comes,human
1386,all e best   ur exam later,human
1387,hope ur head doesn't hurt   much am ploughing my way through a pile of ironing staying in with a chinky tonight come round if you like,human
1388,oh k i think most of wi and nz players unsold,human
1389,"haha where got so fast lose weight, thk muz go   a month den got effect gee,later we go aust put bk e weight",human
1390,"i wonder how you got online, my love had you gone to the net cafe did you get your phone recharged were you on a friends net i think of you, boytoy",human
1391,"haha just kidding, papa needs drugs",human
1392,"thk shld b can ya, i wana go   lessons haha, can go for one whole stretch",human
1393,oh ok,human
1394,r we still meeting   dinner tonight,human
1395,thats cool i am a gentleman and will treat you with dignity and respect,human
1396,shall i start from hear,human
1397,then we wait   u lor no need   feel bad lar,human
1398,no did you check i got his detailed message now,human
1399,you have registered sinco as payee log in at icicibank com and enter urn lt gt to confirm beware of frauds do not share or disclose urn to anyone,human
1400,"no, i decided that only people who care about stuff vote and caring about stuff is for losers",human
1401,kaiez enjoy ur tuition gee thk e second option sounds beta i'll go yan jiu den msg u,human
1402,you have registered sinco as payee log in at icicibank com and enter urn lt gt to confirm beware of frauds do not share or disclose urn to anyone,human
1403,cool we will have fun practicing making babies,human
1404,actually getting ready to leave the house,human
1405,k k any special today,human
1406,"urgent, important information for o  user today is your lucky day   find out why log onto http www urawinner com there is a fantastic surprise awaiting for you",spam
1407,then we gotta do it after that,human
1408,"i've got ten bucks, jay is being noncomittal",human
1409,where at were hungry too,human
1410,pls speak to that customer machan,human
1411,somewhere out there beneath the pale moon light someone think in of u some where out there where dreams come true goodnite amp sweet dreams,human
1412,"wen ur lovable bcums angry wid u, dnt take it seriously coz being angry is d most childish n true way of showing deep affection, care n luv kettoda manda have nice day da",human
1413,dear u've been invited to xchat this is our final attempt to contact u txt chat to    p msgrcvdhg suite   lands row w j hl ldn   yrs,spam
1414,so wats ur opinion abt him and how abt is character,human
1415,jay is snickering and tells me that x is totally fucking up the chords as we speak,human
1416,no few hours before went to hair cut,human
1417,no wonder cos i dun rem seeing a silver car but i thk i saw a black one,human
1418,lmao take a pic and send it to me,human
1419,"\speak only when you feel your words are better than the silence \"" gud mrng """,human
1420,no she's currently in scotland for that,human
1421,do you work all this week,human
1422,congratulations ur awarded either å£  of cd gift vouchers free entry   our å£  weekly draw txt music to   tncs www ldew com   win ppmx age ,spam
1423,lol great now im getting hungry,human
1424,yes now only saw your message,human
1425,i'll be at mu in like lt gt seconds,human
1426,ok,human
1427,thing r good thanx got exams in march ive done no revision is fran still with boyf ive gotta interviw   exeter bit worried x,human
1428,"tell you what, if you make a little spreadsheet and track whose idea it was to smoke to determine who \smokes too much\"" for the entire month of february",human
1429,for sale arsenal dartboard good condition but no doubles or trebles,spam
1430,don't look back at the building because you have no coat and i don't want you to get more sick just hurry home and wear a coat to the gym,human
1431,"my painful personal thought \i always try to keep everybody happy all the time but nobody recognises me when i am alone\""""",human
1432,thanks for ve lovely wisheds you rock,human
1433,you intrepid duo you have a great time and see you both soon,human
1434,i asked sen to come chennai and search for job,human
1435,dad went out oredi,human
1436,"i jus hope its true that missin me cos i'm really missin him you haven't done anything to feel guilty about, yet",human
1437,wat so late still early mah or we juz go   dinner lor aiya i dunno,human
1438,"arms fine, how's cardiff and uni",human
1439,in fact when do you leave i think addie goes back to school tues or wed,human
1440,"cool breeze bright sun fresh flower twittering birds all these waiting to wish u \goodmorning amp have a nice day\"" """,human
1441,ya going for restaurant,human
1442,"its ok , i just askd did u knw tht no",human
1443,free  st week entry   textpod   a chance   win  gb ipod or å£  cash every wk txt pod to   ts cs www textpod net custcare  ,spam
1444,those ducking chinchillas,human
1445,i am in a marriage function,human
1446,looks like u wil b getting a headstart im leaving here bout    ish but if u r desperate for my company i could head in earlier we were goin to meet in rummer,human
1447,donû÷t give a flying monkeys wot they think and i certainly donû÷t mind any friend of mine and all that,human
1448,as a registered optin subscriber ur draw   å£  gift voucher will be entered on receipt of a correct ans to   whats no  in the bbc charts,spam
1449,say thanks ,human
1450,msg me when rajini comes,human
1451,ya when are ì_ taking ure practical lessons i start in june,human
1452,"that's good, because i need drugs",human
1453,stupid its not possible,human
1454,can ì_ all decide faster cos my sis going home liao,human
1455,summers finally here fancy a chat or flirt with sexy singles in yr area to get matched up just reply summer now free   join optout txt stop help ,spam
1456,u sleeping now or you going to take haha i got spys wat me online checking n replying mails lor,human
1457,claire here am havin borin time am now alone u wanna cum over  nite chat now   hope   c u luv claire xx callså£  minmoremobsemspobox po wa,spam
1458,"fighting with the world is easy, u either win or lose bt fightng with some  who is close to u is dificult if u lose u lose if u win u still lose",human
1459,bought one ringtone and now getting texts costing   pound offering more tones etc,spam
1460,"yalru lyfu astne chikku bt innu mundhe lyf ali halla ke bilo marriage program edhae, so lyf is nt yet ovr chikku ali vargu lyfu meow meow d",human
1461,kinda first one gets in at twelve aah speak tomo,human
