,input,output
2629,"hey there glad u r better now i hear u treated urself to a digi cam, is it good we r off at  pm have a fab new year, c u in coupla wks",human
2630,no way i'm going back there,human
2631,"urgent your mobile no  xxx won a å£ ,  bonus caller prize on       this is the  nd attempt to reach you call   asap box n qp,  ppm",spam
2632,i will cal you sir in meeting,human
2633,"that's what i love to hear v see you sundayish, then",human
2634,"sorry da thangam, very very sorry i am held up with prasad",human
2635,tiwary to rcb battle between bang and kochi,human
2636,thank god they are in bed,human
2637,no i don't have cancer moms making a big deal out of a regular checkup aka pap smear,human
2638,am in gobi arts college,human
2639,why she wants to talk to me,human
2640,pandy joined  w technologies today he got job,human
2641,"you are guaranteed the latest nokia phone, a  gb ipod mp  player or a å£  prize txt word collect to no   ibhltd ldnw h  p mtmsgrcvd ",spam
2642,"they can try they can get lost, in fact tee hee",human
2643,hi you just spoke to maneesha v we'd like to know if you were satisfied with the experience reply toll free with yes or no,human
2644,my friends use to call the same,human
2645,"sorry, i'll call later",human
2646,"em, its olowoyey usc edu have a great time in argentina not sad about secretary, everything is a blessing",human
2647,"it,,s a taxt massage tie pos argh ok lool",human
2648,"hi, can i please get a lt gt dollar loan from you i ll pay you back by mid february pls",human
2649,"you might want to pull out more just in case and just plan on not spending it if you can, i don't have much confidence in derek and taylor's money management",human
2650,do you like shaking your booty on the dance floor,human
2651,"text me when you get off, don't call, my phones having problems",human
2652,no need for the drug anymore,human
2653,sorry da i was thought of calling you lot of times lil busy i will call you at noon,human
2654,its sarcasm nt scarcasim,human
2655,great i have to run now so ttyl,human
2656,feel like trying kadeem again v,human
2657,dai lt gt naal eruku,human
2658,not yet chikku wat abt u,human
2659,ok,human
2660,want to finally have lunch today,human
2661,do you know when dad will be back,human
2662,"hello darling how are you today i would love to have a chat, why dont you tell me what you look like and what you are in to sexy",spam
2663,  free for  st week no  nokia tone   ur mob every week just txt nokia to   get txting and tell ur mates www getzed co uk pobox   w   wq norm  p tone  ,spam
2664,he remains a bro amongst bros,human
2665,r u meeting da ge at nite tmr,human
2666,"was a nice day and, impressively, i was sensible, went home early and now feel fine or am i just boring when's yours, i can't remember",human
2667,why de you looking good only,human
2668,wanna get laid  nite want real dogging locations sent direct to ur mobile join the uk's largest dogging network txt park to   now nyt ec a  lp å£    msg,spam
2669,we tried to contact you re your response to our offer of a new nokia fone and camcorder hit reply or call   for delivery,spam
2670,yes they replied my mail i'm going to the management office later plus will in to bank later also or on wednesday,human
2671,"that's cool, i'll come by like lt gt ish",human
2672,super msg da nalla timing,human
2673,"good afternoon, my boytoy how are you feeling today better i hope are you being my good boy are you my obedient, slave do you please your queen",human
2674,i am   ft we will be a good combination,human
2675,i'm sick i'm needy i want you pouts stomps feet where are you pouts stomps feet i want my slave i want him now,human
2676,am on a train back from northampton so i'm afraid not,human
2677,where in abj are you serving are you staying with dad or alone,human
2678,was playng   doors game and gt racing on phone lol,human
2679,"new tones this week include   mcfly all ab ,   sara jorge shock   will smith switch to order follow instructions on next message",spam
2680,"solve d case a man was found murdered on lt decimal gt lt gt afternoon  ,his wife called police  ,police questioned everyone  ,wife sir,i was sleeping, when the murder took place   cook i was cooking   gardener i was picking vegetables   house maid i went   d post office   children we went   play   neighbour we went   a marriage police arrested d murderer immediately who's it reply with reason, if u r brilliant",human
2681,i'm on da bus going home,human
2682,i got a call from a landline number i am asked to come to anna nagar i will go in the afternoon,human
2683,i'm okay chasing the dream what's good what are you doing next,human
2684,yupz i've oredi booked slots   my weekends liao,human
2685,urgent we are trying to contact u todays draw shows that you have won a å£  prize guaranteed call   from land line claim c  valid  hrs only,spam
2686,there r many model sony ericson also der lt gt it luks good bt i forgot modl no,human
2687,okie,human
2688,yes i know the cheesy songs from frosty the snowman,human
2689,"ya ok, vikky vl c witin lt gt mins and il reply u",human
2690,sports fans get the latest sports news str   ur mobile   wk free plus a free tone txt sport on to   www getzed co uk   norm  txt  p,spam
2691,hey tmr meet at bugis  ,human
2692,"urgent urgent we have   free flights to europe to give away, call b   th sept take a friend   free call now to claim on   ba nnfwfly ppm",spam
2693,all these nice new shirts and the only thing i can wear them to is nudist themed _ you in mu,human
2694,hey sexy buns what of that day no word from you this morning on ym i think of you,human
2695,and whenever you and i see we can still hook up too,human
2696,nope but i'm going home now then go pump petrol lor like going   rain soon,human
2697,can you use foreign stamps for whatever you send them off for,human
2698,from   lost å£  help,spam
2699,oh baby of the house how come you dont have any new pictures on facebook,human
2700,"feb lt gt is \i love u\"" day send dis to all ur \""valued frnds\"" evn me if   comes back u'll gt married d person u luv if u ignore dis u will lose ur luv   evr""",human
2701,"hiya, sorry didn't hav signal i haven't seen or heard from and neither has, which is unusual in itself i'll put on the case and get him to sort it out hugs and snogs",human
2702,"omw back to tampa from west palm, you hear what happened",human
2703,yup no more already thanx   printing n handing it up,human
2704,freemsg fancy a flirt reply date now join the uks fastest growing mobile dating service msgs rcvd just  p to optout txt stop to   reply date now,spam
2705,what i mean is do they come chase you out when its over or is it stated you can watch as many movies as you want,human
2706,s now only i took tablets reaction morning only,human
2707,great new offer double mins double txt on best orange tariffs and get latest camera phones   free call mobileupd  free on   now or  stoptxt t cs,spam
2708,"nah, i'm a perpetual dd",human
2709,sorry de i went to shop,human
2710,hope you enjoyed your new content text stop to   to unsubscribe help  p provided by tones you co uk,spam
2711,"wen ur lovable bcums angry wid u, dnt take it seriously coz being angry is d most childish n true way of showing deep affection, care n luv kettoda manda have nice day da",human
2712,hey you still want to go for yogasana coz if we end at cine then can go bathe and hav the steam bath,human
2713,nope i'm not drivin i neva develop da photos lei,human
2714,i am thinking of going down to reg for pract lessons flung my advance haha wat time u going,human
2715,cool i am lt gt inches long hope you like them big,human
2716,"house maid is the murderer, coz the man was murdered on lt gt th january as public holiday all govt instituitions are closed,including post office understand",human
2717,okie thanx,human
2718,  days to euro  kickoff u will be kept informed of all the latest news and results daily unsubscribe send get euro stop to  ,spam
2719,go where n buy juz buy when we get there lar,human
2720,ok lor,human
2721,i'm working technical support voice process,human
2722,it's justbeen overa week since we broke up and already our brains are going to mush,human
2723,"tunde, how are you doing this is just wishing you a great day abiola",human
2724,nope c ì_ then,human
2725,no but we'll do medical missions to nigeria,human
2726,no i am not having not any movies in my laptop,human
2727,whatsup there dont u want to sleep,human
2728,urgent please call   from landline å£  cash or a luxury   canary islands holiday await collection t cs sae award  m aq  ppm   ûï,spam
2729,"urgent please call   from your landline, your complimentary   lux costa del sol holiday or å£  cash await collection ppm   sae t cs james  , eh rr",spam
2730,i havent lei next mon can,human
2731,mm feeling sleepy today itself i shall get that dear,human
2732,how dare you stupid i wont tell anything to you hear after i wont talk to you,human
2733,do ì_ noe if ben is going,human
2734,can you do a mag meeting this avo at some point,human
2735,i meant middle left or right,human
2736,really i crashed out cuddled on my sofa,human
2737,hi chachi tried calling u now unable to reach u pl give me a missed cal once u c tiz msg kanagu,human
2738,"i sent you the prices and do you mean the lt gt g,",human
2739,are you this much buzy,human
2740,nothing can,human
2741,i don't know u and u don't know me send chat to   now and let's find each other only  p msg rcvd hg suite   lands row w j hl ldn   years or over,spam
2742,no am working on the ringing u thing but have whole houseful of screaming brats so am pulling my hair out loving u,human
2743,but my family not responding for anything now am in room not went to home for diwali but no one called me and why not coming it makes me feel like died,human
2744,"tick, tick, tick babe",human
2745,r ì_ going   today's meeting,human
2746,k da how many page you want,human
2747,ya had just now onion roast,human
2748,send his number and give reply tomorrow morning for why you said that to him like that ok,human
2749,you said not now no problem when you can let me know,human
2750,ok but tell me half an hr b  u come i need   prepare,human
2751,play w computer aiyah i tok   u lor,human
2752,sat right okay thanks,human
2753,"derp which is worse, a dude who always wants to party or a dude who files a complaint about the three drug abusers he lives with",human
2754,ok chinese food on its way when i get fat you're paying for my lipo,human
2755,we r outside already,human
2756,have a good trip watch out for remember when you get back we must decide about easter,human
2757,yo we are watching a movie on netflix,human
2758,what time iû÷m out until prob   or so,human
2759,"can meh thgt some will clash really ah, i dun mind i dun seen to have lost any weight gee",human
2760,i dont thnk its a wrong calling between us,human
2761,i am not sure about night menu i know only about noon menu,human
2762,arr birthday today i wish him to get more oscar,human
2763,"say this slowly god,i love you amp i need you,clean my heart with your blood send this to ten special people amp u c miracle tomorrow, do it,pls,pls do it",human
2764,"open rebtel with firefox when it loads just put plus sign in the user name place, and it will show you two numbers the lower number is my number once you pick that number the pin will display okay",human
2765,and picking them up from various points,human
2766,married local women looking for discreet action now   real matches instantly to your phone text match to   msg cost  p   stop txt stop bcmsfwc n xx,spam
2767,wow v v impressed have funs shopping,human
2768,i am on the way to ur home,human
2769,burger king wanna play footy at a top stadium get   burger king before  st sept and go large or super with coca cola and walk out a winner,spam
2770,no problem talk to you later,human
2771,then ur sis how,human
2772,still in customer place,human
2773,how come it takes so little time for a child who is afraid of the dark to become a teenager who wants to stay out all night,spam
2774,"dude u knw also telugu thts gud k, gud nyt",human
2775,we confirm eating at esplanade,human
2776,send me your id and password,human
2777,kind of took it to garage centre part of exhaust needs replacing part ordered n taking it to be fixed tomo morning,human
2778,"for ur chance to win a å£  cash every wk txt action to   t's c's www movietrivia tv custcare  ,  x p wk",spam
2779,well i might not come then,human
2780,long after i quit i get on only like   minutes a day as it is,human
2781,then its most likely called mittelschmertz google it if you dont have paracetamol dont worry it will go,human
2782,well at this right i'm gonna have to get up and check today's steam sales pee so text me when you want me to come get you,human
2783,"just arrived, see you in a couple days lt  ",human
2784,"k, wat s tht incident",human
2785,yeah get the unlimited,human
2786,cthen i thk shd b enuff still got conclusion n contents pg n references i'll b doing da contents pg n cover pg,human
2787,"forgot it takes me   years to shower, sorry where you at your phone dead yet",human
2788,ìï got wat to buy tell us then ì_ no need to come in again,human
2789,when you are big | god will bring success,human
2790,uûªve bin awarded å£  to play   instant cash call   to claim every  th player wins min å£  å£  optout  ,spam
2791,"û_ we r stayin here an extra week, back next wed how did we do in the rugby this weekend hi to and and , c u soon \"" ham""",human
2792,not from this campus are you in the library,human
2793,"the affidavit says lt gt e twiggs st, division g, courtroom lt gt , lt time gt am i'll double check and text you again tomorrow",human
2794,how will i creep on you now _,human
2795,tell your friends what you plan to do on valentines day lt url gt,human
2796,if i get there before you after your ten billion calls and texts so help me god,human
2797,purity of friendship between two is not about smiling after reading the forwarded message its about smiling just by seeing the name gud evng musthu,human
2798,i've told him that i've returned it that should i re order it,human
2799,"house maid is the murderer, coz the man was murdered on lt gt th january as public holiday all govt instituitions are closed,including post office",human
2800,depends on where u going lor,human
2801,and smile for me right now as you go and the world will wonder what you are smiling about and think your crazy and keep away from you grins,human
2802,freemsg fav xmas tones reply real,spam
2803,lil fever now fine,human
2804,i think it's all still in my car,human
2805,can a not,human
2806,december only had your mobile  mths you are entitled to update to the latest colour camera mobile for free call the mobile update co free on  ,spam
2807,yes princess i want to catch you with my big strong hands,human
2808,oh yeah i forgot u can only take   out shopping at once,human
2809,mm so you asked me not to call radio,human
2810,thinkin about someone is all good no drugs for that,human
2811,"say this slowly god,i love you amp i need you,clean my heart with your blood send this to ten special people amp u c miracle tomorrow, do it,pls,pls do it",human
2812,"enjoy the showers of possessiveness poured on u by ur loved ones, bcoz in this world of lies, it is a golden gift to be loved truly",human
2813,"alright if you're sure, let me know when you're leaving",human
2814,some are lasting as much as   hours you might get lucky,human
2815,genius what's up how your brother pls send his number to my skype,human
2816,"gr  poly tones   all mobs direct  u rply with poly title to   eg poly breathe  titles crazyin, sleepingwith, finest, ymca getzed co uk pobox o w wq  p",spam
2817,thk some of em find wtc too far weiyi not goin e rest i dunno yet r ur goin   dinner den i might b able to join,human
2818,don't forget who owns you and who's private property you are and be my good boy always passionate kiss,human
2819,interflora åòit's not too late to order interflora flowers for christmas call     to place your order before midnight tomorrow,spam
2820,oh god taken the teeth is it paining,human
2821,romcapspam everyone around should be responding well to your presence since you are so warm and outgoing you are bringing in a real breath of sunshine,spam
2822,then u ask darren go n pick u lor but i oso sian tmr haf   meet lect,human
2823,no need to buy lunch for me i eat maggi mee,human
2824,"congratulations thanks to a good friend u have won the å£ ,  xmas prize   claim is easy, just call   now only  p per minute bt national rate",spam
2825,ok lor,human
2826,"oh right, ok i'll make sure that i do loads of work during the day got a really nasty cough today and is dry n shot so that should really help it",human
2827,wife how she knew the time of murder exactly,human
2828,send a logo   ur lover   names joined by a heart txt love name  name  mobno eg love adam eve   to   yahoo pobox w wq txtno   no ads  p,spam
2829,howz that persons story,human
2830,thanx   sending me home,human
2831,its normally hot mail com you see,human
2832,"you've won tkts to the euro  cup final or å£  cash, to collect call   b , pobox  ppm",spam
2833,u sick still can go shopping,human
2834,"ya they are well and fine , bbd pooja full pimples even she become quite black and ur rite here its too cold, wearing sweatter",human
2835,nice nice how is it working,human
2836, 's reach home call me,human
2837,were trying to find a chinese food place around here,human
2838,"easy mate, guess the quick drink was bit ambitious",human
2839,babe i miiiiiiissssssssss you i need you i crave you geeee i'm so sad without you babe i love you,human
2840,ok thanx,human
2841,aathi where are you dear,human
2842,"tunji, how's the queen how are you doing this is just wishing you a great day abiola",human
2843,today iz yellow rose day if u love my frndship give me   misscall amp send this to ur frndz amp see how many miss calls u get if u get  missed u marry ur lover,human
2844,will be out of class in a few hours sorry,human
2845,wat time u finish ur lect today,human
2846,"free message jamster get the crazy frog sound now for poly text mad , for real text mad  to     crazy sounds for just   gbp week   only t c's apply",spam
2847,"sad story of a man last week was my b'day my wife did'nt wish me my parents forgot n so did my kids i went to work even my colleagues did not wish as i entered my cabin my pa said, '' happy b'day boss '' i felt special she askd me   lunch after lunch she invited me to her apartment we went there she said,'' do u mind if i go into the bedroom for a minute '' ''ok'', i sed in a sexy mood she came out   minuts latr wid a cake n my wife, my parents, my kidz, my friends n my colleagues all screaming surprise and i was waiting on the sofa ' naked",human
2848,"your chance to be on a reality fantasy show call now   just  p per min ntt ltd, po box   croydon cr   wb   is a national rate call",spam
2849,she's fine good to hear from you how are you my dear happy new year oh,human
2850,are you going to wipro interview today,human
2851,how tall are you princess,human
2852,i doubt you could handle   times per night in any case,human
2853,haha hope ì_ can hear the receipt sound gd luck,human
2854,your gonna be the death if me i'm gonna leave a note that says its all robs fault avenge me,human
2855,"japanese proverb if one can do it, u too can do it, if none can do it,u must do it indian version if one can do it, let him do it if none can do it,leave it and finally kerala version if one can do it, stop him doing it if none can do it, make a strike against it",human
2856,today i'm not workin but not free oso gee thgt u workin at ur fren's shop,human
2857,in life when you face choices just toss a coin not becoz its settle the question but while the coin in the air u will know what your heart is hoping for gudni ,human
2858,"do you know why god created gap between your fingers so that, one who is made for you comes amp fills those gaps by holding your hand with love",human
2859,i want to be there so i can kiss you and feel you next to me,human
2860,i am not at all happy with what you saying or doing,human
2861,adult   content your video will be with you shortly,spam
2862,"ok that would b lovely, if u r sure think about wot u want to do, drinkin, dancin, eatin, cinema, in, out, about up to u wot about",human
2863,what i'm saying is if you haven't explicitly told nora i know someone i'm probably just not gonna bother,human
2864,he says hi and to get your ass back to south tampa preferably at a kegger,human
2865,smith waste da i wanna gayle,human
2866,"mum, i've sent you many many messages since i got here i just want to know that you are actually getting them do enjoy the rest of your day",human
2867,"aight, tomorrow around lt gt it is",human
2868,"house maid is the murderer, coz the man was murdered on lt gt th january as public holiday all govt instituitions are closed,including post office understand",human
2869,"your chance to be on a reality fantasy show call now   just  p per min ntt ltd, po box   croydon cr   wb   is a national rate call",spam
2870,i actually did for the first time in a while i went to bed not too long after i spoke with you woke up at   how was your night,human
2871,see you there,human
2872,i dont understand your message,human
2873,crucify is c not s you should have told me earlier,human
2874,"idk you keep saying that you're not, but since he moved, we keep butting heads over freedom vs responsibility and i'm tired i have so much other shit to deal with that i'm barely keeping myself together once this gets added to it",human
2875,fuck cedar key and fuck her come over anyway tho,human
2876,twenty past five he said will this train have been to durham already or not coz i am in a reserved seat,human
2877,"hey boys want hot xxx pics sent direct   ur phone txt porn to  ,  hrs free and then just  p per day to stop text stopbcm sf wc n xx",spam
2878,u still painting ur wall,human
2879,"last chance claim ur å£  worth of discount vouchers today text shop to   now savamob, offers mobile t cs savamob pobox , m uz å£    sub  ",spam
2880,printer is cool i mean groovy wine is groovying,human
2881,hi harish's rent has been transfred to ur acnt,human
2882,anything lor is she coming,human
2883,cbe is really good nowadays lot of shop and showrooms city is shaping good,human
2884,ìï still attending da talks,human
2885,no probs hon how u doinat the mo,human
2886,k i'll take care of it,human
2887,i take it we didn't have the phone callon friday can we assume we won't have it this year now,human
2888,my battery is low babe,human
2889,shuhui has bought ron's present it's a swatch watch,human
2890,"yeah there's quite a bit left, i'll swing by tomorrow when i get up",human
2891,babe you said   hours and it's been almost   is your internet down,human
2892,k i'll be sure to get up before noon and see what's what,human
2893,k k yesterday i was in cbe,human
2894,went to ganesh dress shop,human
2895,"pdate_now double mins and   txts on orange tariffs latest motorola, sonyericsson nokia bluetooth free call mobileupd  on   or call optout yhl",spam
2896,ìï collecting ur laptop then going to configure da settings izzit,human
2897,if you r home then come down within   min,human
2898,"aight, i should be there by   at the latest, probably closer to   are jay and tyler down or should we just do two trips",human
2899,come aftr lt decimal gt now i m cleaning the house,human
2900,ur cash balance is currently   pounds to maximize ur cash in now send cash to   only  p msg cc   po box     tcr w ,spam
2901,"bill, as in are there any letters for me iûªm expecting one from orange that isnûªt a bill but may still say orange on it",human
2902,tell me pa how is pain de,human
2903,hi darlin i hope you had a nice night i wish i had come cant wait to see you love fran ps i want dirty anal sex and i want a   man gang bang,human
2904,"ha you donû÷t know either i did a a clever but simple thing with pears the other day, perfect for christmas",human
2905,"helloooo wake up \sweet\"" \""morning\"" \""welcomes\"" \""you\"" \""enjoy\"" \""this day\"" \""with full of joy\"" \""gud mrng\"" """,human
2906,alrite,human
2907,why must we sit around and wait for summer days to celebrate such a magical sight when the worlds dressed in white oooooh let there be snow,human
2908,urgent your mobile number has been awarded with a å£  prize guaranteed call   from land line claim   valid  hrs only,spam
2909,how do you guys go to see movies on your side,human
2910,"sorry,in meeting i'll call later",human
2911,you didn't have to tell me that now i'm thinking plus he's going to stop all your runs,human
2912,kindly send some one to our flat before lt decimal gt today,human
2913,sorry u can not unsubscribe yet the mob offer package has a min term of   weeks pls resubmit request after expiry reply themob help   more info,spam
2914,nothing lor a bit bored too then y dun u go home early   sleep today,human
2915,what time should i tell my friend to be around,human
2916,yes that will be fine love you be safe,human
2917,thanks chikku gud nyt,human
2918,is xy in ur car when u picking me up,human
2919,"thanx   the time weåõve spent  geva, its bin mint ur my baby and all i want is u xxxx",human
2920,"yo, any way we could pick something up tonight",human
2921,i've not sent it he can send me,human
2922,fine am simply sitting,human
2923,thts god's gift for birds as humans hav some natural gift frm god,human
2924,are you coming to day for class,human
2925,im done just studyn in library,human
2926,ok u enjoy ur shows,human
2927,anything,human
2928,where wuld i be without my baby the thought alone mite break me and i donåõt wanna go crazy but everyboy needs his lady xxxxxxxx,human
2929,wat's my dear doing sleeping ah,human
2930,hi' test on lt gt rd,human
