,input,output
0,"go until jurong point, crazy available only in bugis n great world la e buffet cine there got amore wat",human
1,ok lar joking wif u oni,human
2,free entry in   a wkly comp to win fa cup final tkts  st may   text fa to   to receive entry question std txt rate t c's apply  over 's,spam
3,u dun say so early hor u c already then say,human
4,"nah i don't think he goes to usf, he lives around here though",human
5,"freemsg hey there darling it's been   week's now and no word back i'd like some fun you up for it still tb ok xxx std chgs to send, å£    to rcv",spam
6,even my brother is not like to speak with me they treat me like aids patent,human
7,as per your request 'melle melle oru minnaminunginte nurungu vettam ' has been set as your callertune for all callers press   to copy your friends callertune,human
8,winner as a valued network customer you have been selected to receivea å£  prize reward to claim call   claim code kl  valid   hours only,spam
9,had your mobile   months or more u r entitled to update to the latest colour mobiles with camera for free call the mobile update co free on  ,spam
10,"i'm gonna be home soon and i don't want to talk about this stuff anymore tonight, k i've cried enough today",human
11,"six chances to win cash from   to  ,  pounds txt csh  and send to   cost  p day,  days,   tsandcs apply reply hl   info",spam
12,"urgent you have won a   week free membership in our å£ ,  prize jackpot txt the word claim to no   t c www dbuk net lccltd pobox  ldnw a rw ",spam
13,i've been searching for the right words to thank you for this breather i promise i wont take your help for granted and will fulfil my promise you have been wonderful and a blessing at all times,human
14,i have a date on sunday with will,human
15,"xxxmobilemovieclub to use your credit, click the wap link in the next txt message or click here http wap xxxmobilemovieclub com n qjkgighjjgcbl",spam
16,oh k i'm watching here,human
17,eh u remember how   spell his name yes i did he v naughty make until i v wet,human
18,fine if thatåõs the way u feel thatåõs the way its gota b,human
19,"england v macedonia dont miss the goals team news txt ur national team to   eg england to   try wales, scotland  txt ì¼    poboxox w wq  ",spam
20,is that seriously how you spell his name,human
21,iû÷m going to try for   months ha ha only joking,human
22,so ì_ pay first lar then when is da stock comin,human
23,aft i finish my lunch then i go str down lor ard   smth lor u finish ur lunch already,human
24,ffffffffff alright no way i can meet up with you sooner,human
25,just forced myself to eat a slice i'm really not hungry tho this sucks mark is getting worried he knows i'm sick when i turn down pizza lol,human
26,lol your always so convincing,human
27,did you catch the bus are you frying an egg did you make a tea are you eating your mom's left over dinner do you feel my love,human
28,"i'm back amp we're packing the car now, i'll let you know if there's room",human
29,ahhh work i vaguely remember that what does it feel like lol,human
30,"wait that's still not all that clear, were you not sure about me being sarcastic or that that's why x doesn't want to live with us",human
31,yeah he got in at   and was v apologetic n had fallen out and she was actin like spoilt child and he got caught up in that till   but we won't go there not doing too badly cheers you,human
32,k tell me anything about you,human
33,for fear of fainting with the of all that housework you just did quick have a cuppa,human
34,thanks for your subscription to ringtone uk your mobile will be charged å£  month please confirm by replying yes or no if you reply no you will not be charged,spam
35,yup ok i go home look at the timings then i msg ì_ again xuhui going to learn on  nd may too but her lesson is at  am,human
36,"oops, i'll let you know when my roommate's done",human
37,i see the letter b on my car,human
38,anything lor u decide,human
39,hello how's you and how did saturday go i was just texting to see if you'd decided to do anything tomo not that i'm trying to invite myself or anything,human
40,pls go ahead with watts i just wanted to be sure do have a great weekend abiola,human
41,"did i forget to tell you i want you , i need you, i crave you but most of all i love you my sweet arabian steed mmmmmm yummy",human
42,  rodger burns msg we tried to call you re your reply to our sms for a free nokia mobile free camcorder please call now   for delivery tomorrow,spam
43,who are you seeing,human
44,great i hope you like your man well endowed i am lt gt inches,human
45,no calls messages missed calls,human
46,didn't you get hep b immunisation in nigeria,human
47,"fair enough, anything going on",human
48,"yeah hopefully, if tyler can't do it i could maybe ask around a bit",human
49,u don't know how stubborn i am i didn't even want to go to the hospital i kept telling mark i'm not a weak sucker hospitals are for weak suckers,human
50,what you thinked about me first time you saw me in class,human
51,"a gram usually runs like lt gt , a half eighth is smarter though and gets you almost a whole second gram for lt gt",human
52,k fyi x has a ride early tomorrow morning but he's crashing at our place tonight,human
53,"wow i never realized that you were so embarassed by your accomodations i thought you liked it, since i was doing the best i could and you always seemed so happy about \the cave\"" i'm sorry i didn't and don't have more to give i'm sorry i offered i'm sorry your room was so embarassing """,human
54,sms ac sptv the new jersey devils and the detroit red wings play ice hockey correct or incorrect end reply end sptv,spam
55,do you know what mallika sherawat did yesterday find out now lt url gt,human
56,"congrats   year special cinema pass for   is yours call   now c suprman v, matrix , starwars , etc all   free bx  ip   we  pm dont miss out",spam
57,"sorry, i'll call later in meeting",human
58,tell where you reached,human
59,yes gauti and sehwag out of odi series,human
60,your gonna have to pick up a   burger for yourself on your way home i can't even move pain is killing me,human
61,ha ha ha good joke girls are situation seekers,human
62,its a part of checking iq,human
63,"sorry my roommates took forever, it ok if i come by now",human
64,ok lar i double check wif da hair dresser already he said wun cut v short he said will cut until i look nice,human
65,"as a valued customer, i am pleased to advise you that following recent review of your mob no you are awarded with a å£  bonus prize, call  ",spam
66,"today is \song dedicated day \"" which song will u dedicate for me send this to all ur valuable frnds but first rply me """,human
67,"urgent ur awarded a complimentary trip to eurodisinc trav, aco entry  or å£  to claim txt dis to       å£    morefrmmob shracomorsglsuplt  , ls   aj",spam
68,"did you hear about the new \divorce barbie\"" it comes with all of ken's stuff """,spam
69,i plane to give on this month end,human
70,wah lucky man then can save money hee,human
71,finished class where are you,human
72,hi babe im at home now wanna do something xx,human
73,k k where are you how did you performed,human
74,u can call me now,human
75,i am waiting machan call me once you free,human
76,thats cool i am a gentleman and will treat you with dignity and respect,human
77,i like you peoples very much but am very shy pa,human
78,does not operate after lt gt or what,human
79,its not the same here still looking for a job how much do ta's earn there,human
80,"sorry, i'll call later",human
81,k did you call me just now ah,human
82,ok i am on the way to home hi hi,human
83,you will be in the place of that man,human
84,yup next stop,human
85,"i call you later, don't have network if urgnt, sms me",human
86,for real when u getting on yo i only need   more tickets and one more jacket and i'm done i already used all my multis,human
87,yes i started to send requests to make it but pain came back so i'm back in bed double coins at the factory too i gotta cash in all my nitros,human
88,i'm really not up to it still tonight babe,human
89,"ela kano ,il download, come wen ur free",human
90,yeah do donû÷t stand to close tho youû÷ll catch something,human
91,sorry to be a pain is it ok if we meet another night i spent late afternoon in casualty and that means i haven't done any of y stuff moro and that includes all my time sheets and that sorry,human
92,smile in pleasure smile in pain smile when trouble pours like rain smile when sum  hurts u smile becoz someone still loves to see u smiling,human
93,please call our customer service representative on       between  am  pm as you have won a guaranteed å£  cash or å£  prize,spam
94,havent planning to buy later i check already lido only got   show in e afternoon u finish work already,human
95,"your free ringtone is waiting to be collected simply text the password \mix\"" to   to verify get usher and britney fml",spam
96,watching telugu movie wat abt u,human
97,i see when we finish we have loads of loans to pay,human
98,"hi wk been ok on hols now yes on for a bit of a run forgot that i have hairdressers appointment at four so need to get home n shower beforehand does that cause prob for u \"" ham""",human
99,please don't text me anymore i have nothing else to say,human
100,okay name ur price as long as its legal wen can i pick them up y u ave x ams xx,human
101,i'm still looking for a car to buy and have not gone  the driving test yet,human
102,as per your request 'melle melle oru minnaminunginte nurungu vettam ' has been set as your callertune for all callers press   to copy your friends callertune,human
103,"wow you're right i didn't mean to do that i guess once i gave up on boston men and changed my search location to nyc, something changed cuz on my signin page it still says boston",human
104,umma my life and vava umma love you lot dear,human
105,thanks a lot for your wishes on my birthday thanks you for making my birthday truly memorable,human
106,"aight, i'll hit you up when i get some cash",human
107,how would my ip address test that considering my computer isn't a minecraft server,human
108,i know grumpy old people my mom was like you better not be lying then again i am always the one to play jokes,human
109,dont worry i guess he's busy,human
110,what is the plural of the noun research,human
111,going for dinner msg you after,human
112,i'm ok wif it cos i like   try new things but i scared u dun like mah cos u said not too loud,human
113,gent we are trying to contact you last weekends draw shows that you won a å£  prize guaranteed call   claim code k  valid  hrs only  ppm,spam
114,"wa, ur openin sentence very formal anyway, i'm fine too, juz tt i'm eatin too much n puttin on weight haha so anythin special happened",human
115,"as i entered my cabin my pa said, '' happy b'day boss '' i felt special she askd me   lunch after lunch she invited me to her apartment we went there",human
116,you are a winner u have been specially selected   receive å£  or a   holiday flights inc speak to a live operator   claim  p min  ,spam
117,goodo yes we must speak friday egg potato ratio for tortilla needed,human
118,hmm my uncle just informed me that he's paying the school directly so pls buy food,human
119,private your   account statement for   shows   unredeemed bonus points to claim call   identifier code   expires,spam
120,"urgent your mobile no was awarded å£  bonus caller prize on       this is our final try to contact u call from landline   box wr c,  ppm",spam
121,here is my new address apples pairs all that malarky,human
122,todays voda numbers ending   are selected to receive a   award if you have a match please call   quoting claim code   standard rates app,spam
123,i am going to sao mu today will be done only at  ,human
124,ìï predict wat time ì_'ll finish buying,human
125,"good stuff, will do",human
126,"just so that you know,yetunde hasn't sent money yet i just sent her a text not to bother sending so its over, you dont have to involve yourself in anything i shouldn't have imposed anything on you in the first place so for that, i apologise",human
127,are you there in room,human
128,hey girl how r u hope u r well me an del r bak again long time no c give me a call sum time from lucyxx,human
129,k k how much does it cost,human
130,i'm home,human
131,"dear, will call tmorrow pls accomodate",human
132,first answer my question,human
133,sunshine quiz wkly q win a top sony dvd player if u know which country the algarve is in txt ansr to   å£    sp tyrone,spam
134,want   get laid tonight want real dogging locations sent direct   ur mob join the uk's largest dogging network bt txting gravel to   nt ec a  p msg  p,spam
135,i only haf msn it's yijue hotmail com,human
136,he is there you call and meet him,human
137,no no i will check all rooms befor activities,human
138,you'll not rcv any more msgs from the chat svc for free hardcore services text go to   if u get nothing u must age verify with yr network try again,spam
139,got c i lazy to type i forgot ì_ in lect i saw a pouch but like not v nice,human
140,"k, text me when you're on the way",human
141,"sir, waiting for your mail",human
142,"a swt thought \nver get tired of doing little things   lovable persons \"" coz somtimes those little things occupy d biggest part in their hearts gud ni """,human
143,i know you are can you pls open the back,human
144,yes see ya not on the dot,human
145,whats the staff name who is taking class for us,human
146,"freemsg why haven't you replied to my text i'm randy, sexy, female and live local luv to hear from u netcollex ltd  p per msg reply stop to end",spam
147,ummma will call after check in our life will begin from qatar so pls pray very hard,human
148,k i deleted my contact that why,human
149,sindu got job in birla soft,human
150,the wine is flowing and i'm i have nevering,human
151,yup i thk cine is better cos no need   go down   plaza mah,human
152,ok ur typical reply,human
153,as per your request 'melle melle oru minnaminunginte nurungu vettam ' has been set as your callertune for all callers press   to copy your friends callertune,human
154,"you are everywhere dirt, on the floor, the windows, even on my shirt and sometimes when i open my mouth, you are all that comes flowing out i dream of my world without you, then half my chores are out too a time of joy for me, lots of tv shows i ll see but i guess like all things you just must exist, like rain, hail and mist, and when my time here is done, you and i become one",human
155,aaooooright are you at work,human
156,i'm leaving my house now,human
157,"hello, my love what are you doing did you get to that interview today are you you happy are you being a good boy do you think of me are you missing me",human
158,customer service annoncement you have a new years delivery waiting for you please call   now to arrange delivery,spam
159,you are a winner u have been specially selected   receive å£  cash or a   holiday flights inc speak to a live operator   claim  ,spam
160,keep yourself safe for me because i need you and i miss you already and i envy everyone that see's you in real life,human
161,new car and house for my parents i have only new job in hand,human
162,i'm so in love with you i'm excited each day i spend with you you make me so happy,human
163,pls stop bootydelious   f is inviting you to be her friend reply yes   or no   see her www sms ac u bootydelious stop send stop frnd to  ,spam
164,"bangbabes ur order is on the way u should receive a service msg   download ur content if u do not, goto wap bangb tv on ur mobile internet service menu",spam
165,i place all ur points on e cultures module already,human
166,urgent we are trying to contact you last weekends draw shows that you have won a å£  prize guaranteed call   claim code s  valid  hrs only,spam
167,"hi frnd, which is best way to avoid missunderstding wit our beloved one's",human
168,great escape i fancy the bridge but needs her lager see you tomo,human
169,yes it completely in out of form clark also utter waste,human
170,"sir, i need axis bank account no and bank address",human
171,"hmmm thk sure got time to hop ard ya, can go   free abt muz call u to discuss liao",human
172,what time you coming down later,human
173,"bloody hell, cant believe you forgot my surname mr ill give u a clue, its spanish and begins with m",human
174,"well, i'm gonna finish my bath now have a good fine night",human
175,let me know when you've got the money so carlos can make the call,human
176,u still going to the mall,human
177,"turns out my friends are staying for the whole show and won't be back til lt gt , so feel free to go ahead and smoke that lt gt worth",human
178,text her if she doesnt reply let me know so i can have her log in,human
179,hi you just spoke to maneesha v we'd like to know if you were satisfied with the experience reply toll free with yes or no,human
180,you lifted my hopes with the offer of money i am in need especially when the end of the month approaches and it hurts my studying anyways have a gr  weekend,human
181,lol no u can trust me,human
182,ok i am a gentleman and will treat you with dignity and respect,human
183,"he will, you guys close",human
184,going on nothing great bye,human
185,hello handsome are you finding that job not being lazy working towards getting back that net for mummy where's my boytoy now does he miss me,human
186,"haha awesome, be there in a minute",human
187,please call our customer service representative on freephone       between  am  pm as you have won a guaranteed å£  cash or å£  prize,spam
188,have you got xmas radio times if not i will get it now,human
189,i jus reached home i go bathe first but my sis using net tell u when she finishes k,human
190,are you unique enough find out from  th august www areyouunique co uk,spam
191,i'm sorry i've joined the league of people that dont keep in touch you mean a great deal to me you have been a friend at all times even at great personal cost do have a great week |,human
192,hi finally i completed the course,human
193,it will stop on itself i however suggest she stays with someone that will be able to give ors for every stool,human
194,how are you doing hope you've settled in for the new school year just wishin you a gr  day,human
195,gud mrng dear hav a nice day,human
196,did u got that persons story,human
197,is your hamster dead hey so tmr i meet you at  pm orchard mrt,human
198,hi its kate how is your evening i hope i can see you tomorrow for a bit but i have to bloody babyjontet txt back if u can xxx,human
199,"found it, enc lt gt , where you at",human
200,i sent you lt gt bucks,human
201,hello darlin ive finished college now so txt me when u finish if u can love kate xxx,human
202,your account has been refilled successfully by inr lt decimal gt your keralacircle prepaid account balance is rs lt decimal gt your transaction id is kr lt gt,human
203,goodmorning sleeping ga,human
204,u call me alter at   ok,human
205,ìï say until like dat i dun buy ericsson oso cannot oredi lar,human
206,"as i entered my cabin my pa said, '' happy b'day boss '' i felt special she askd me   lunch after lunch she invited me to her apartment we went there",human
207,"aight yo, dats straight dogg",human
208,you please give us connection today itself before lt decimal gt or refund the bill,human
209,both i shoot big loads so get ready,human
210,"what's up bruv, hope you had a great break do have a rewarding semester",human
211,home so we can always chat,human
212,k k good study well,human
213,yup how ì_ noe leh,human
214,sounds great are you home now,human
215,finally the match heading towards draw as your prediction,human
216,tired i haven't slept well the past few nights,human
217,easy ah sen got selected means its good,human
218,i have to take exam with march  ,human
219,yeah you should i think you can use your gt atm now to register not sure but if there's anyway i can help let me know but when you do be sure you are ready,human
220,ok no prob take ur time,human
221,there is os called ubandu which will run without installing in hard disk you can use that os to copy the important files in system and give it to repair shop,human
222,"sorry, i'll call later",human
223,u say leh of course nothing happen lar not say v romantic jus a bit only lor i thk e nite scenery not so nice leh,human
224,"  new mobiles from  , must go txt nokia to no   collect yours today from only å£  www   tc biz  optout    gbp mtmsg ",spam
225,would really appreciate if you call me just need someone to talk to,human
226,"will u meet ur dream partner soon is ur career off   a flyng start   find out free, txt horo followed by ur star sign, e g horo aries",spam
227,hey company elama po mudyadhu,human
228,"life is more strict than teacher bcoz teacher teaches lesson amp then conducts exam, but life first conducts exam amp then teaches lessons happy morning",human
229,dear good morning now only i am up,human
230,get down in gandhipuram and walk to cross cut road right side lt gt street road and turn at first right,human
231,dear we are going to our rubber place,human
232,"sorry battery died, yeah i'm here",human
233,yes here tv is always available in work place,human
234,text meet someone sexy today u can find a date or even flirt its up to u join   just  p reply with name age eg sam     msg recd thirtyeight pence,spam
235,i have printed it oh so lt gt come upstairs,human
236,or ill be a little closer like at the bus stop on the same street,human
237,where are you when wil you reach here,human
238,"new theory argument wins d situation, but loses the person so dont argue with ur friends just kick them amp say, i'm always correct",human
239,u   have a secret admirer who is looking   make contact with u find out who they r reveal who thinks ur so special call on  ,spam
240,tomarrow final hearing on my laptop case so i cant,human
241,pleassssssseeeeee tel me v avent done sportsx,human
242,"okay no no, just shining on that was meant to be signing, but that sounds better",human
243,"although i told u dat i'm into baig face watches now but i really like e watch u gave cos it's fr u thanx   everything dat u've done today, i'm touched",human
244,u don't remember that old commercial,human
245,too late i said i have the website i didn't i have or dont have the slippers,human
246,i asked you to call him now ok,human
247,kallis wont bat in  nd innings,human
248,it didnt work again oh ok goodnight then i ll fix and have it ready by the time you wake up you are very dearly missed have a good night sleep,human
249,congratulations ur awarded   of cd vouchers or  gift guaranteed free entry     wkly draw txt music to   tncs www ldew com win ppmx age ,spam
250,ranjith cal drpd deeraj and deepak  min hold,human
251,"wen ur lovable bcums angry wid u, dnt take it seriously coz being angry is d most childish n true way of showing deep affection, care n luv kettoda manda have nice day da",human
252,what you doing how are you,human
253,"ups which is  days also, and the shipping company that takes  wks the other way is usps which takes a week but when it gets to lag you may have to bribe nipost to get your stuff",human
254,"i'm back, lemme know when you're ready",human
255,don't necessarily expect it to be done before you get back though because i'm just now headin out,human
256,mmm so yummy babe nice jolt to the suzy,human
257,where are you lover i need you,human
258,we tried to contact you re your reply to our offer of a video handset   anytime networks mins unlimited text camcorder reply or call   now,spam
259,iû÷m parked next to a mini when are you coming in today do you think,human
260,yup,human
261,anyway i'm going shopping on my own now cos my sis not done yet dun disturb u liao,human
262,my no in luton   ring me if ur around h,human
263,hey i am really horny want to chat or see me naked text hot to   text charged at  pm to unsubscribe text stop  ,spam
264,why you dint come with us,human
265,same wana plan a trip sometme then,human
266,"not sure yet, still trying to get a hold of him",human
267,ur ringtone service has changed   free credits go to club mobiles com to choose content now stop txt club stop to    p wk club  po box  mk   wt,spam
268,the evo i just had to download flash jealous,human
269,ringtone club get the uk singles chart on your mobile each week and choose any top quality ringtone this message is free of charge,spam
270,"come to mu, we're sorting out our narcotics situation",human
271,"night has ended for another day, morning has come in a special way may you smile like the sunny rays and leaves your worries at the blue blue bay",human
272,hmv bonus special   pounds of genuine hmv vouchers to be won just answer   easy questions play now send hmv to   more info www  percent real com,spam
273,"usf i guess, might as well take   car",human
274,no objection my bf not coming,human
275,thanx,human
276,tell rob to mack his gf in the theater,human
277,"awesome, i'll see you in a bit",human
278,just sent it so what type of food do you like,human
279,all done all handed in celebrations in full swing yet,human
280,you got called a tool,human
281,\wen u miss someone,human
282,ok i asked for money how far,human
283,okie,human
284,"yeah i think my usual guy's still passed out from last night, if you get ahold of anybody let me know and i'll throw down",human
285,"k, i might come by tonight then if my class lets out early",human
286,ok,human
287,hi baby im cruisin with my girl friend what r u up   give me a call in and hour at home if thats alright or fone me on this fone now love jenny xxx,human
288,"my life means a lot to me, not because i love my life, but because i love the people in my life, the world calls them friends, i call them my world ge",human
