,input,output
4135,have you ever had one foot before,human
4136,just got to lt gt,human
4137,"good no, donû÷t need any receiptsûówell done û_ yes, please tell whatû÷s her number, i could ring her",human
4138,"ever green quote ever told by jerry in cartoon \a person who irritates u always is the one who loves u vry much but fails to express it gud nyt""",human
4139,leave it wif me lar ìï wan to carry meh so heavy is da num   familiar to ì_,human
4140,beautiful truth expression of the face could be seen by everyone but the depression of heart could be understood only by the loved ones gud ni ,human
4141,infact happy new year how are you where are you when are we seeing,human
4142,"in the simpsons movie released in july   name the band that died at the start of the film a green day, b blue day, c red day send a, b or c",spam
4143,that's a shame maybe cld meet for few hrs tomo,human
4144,lol i would but despite these cramps i like being a girl,human
4145,i canåõt wait for cornwall hope tonight isnåõt too bad as well but itåõs rock night shite anyway iåõm going for a kip now have a good night speak to you soon,human
4146,pls help me tell sura that i'm expecting a battery from hont and that if should pls send me a message about how to download movies thanks,human
4147,please call amanda with regard to renewing or upgrading your current t mobile handset free of charge offer ends today tel       subject to t's and c's,spam
4148,"haven't found a way to get another app for your phone, eh will you go to the net cafe did you take that job geeee i need you babe i crave to see you",human
4149,i only work from mon to thurs but sat i cant leh booked liao which other day u free,human
4150,ìï comin to fetch us oredi,human
4151,what's nannys address,human
4152,"urgent your   costa del sol holiday or å£  await collection call   now toclaim sae, tc s, pobox , stockport, sk xh, costå£    pm, max mins",spam
4153,haf u eaten wat time u wan me   come,human
4154,want a new video phone   anytime any network mins half price line rental free text for   months reply or call   for free delivery,spam
4155,"yo, call me when you get the chance, a friend of mine wanted me to ask you about a big order",human
4156,this single single answers are we fighting plus i said am broke and you didnt reply,human
4157,it certainly puts things into perspective when something like this happens,human
4158,now got tv   watch meh u no work today,human
4159,i felt so not any conveying reason ese he what about me,human
4160,had your mobile   months or more u r entitled to update to the latest colour mobiles with camera for free call the mobile update co free on  ,spam
4161,how's it going got any exciting karaoke type activities planned i'm debating whether to play football this eve feeling lazy though,human
4162,i told that am coming on wednesday,human
4163,"its ok, called mom instead have fun",human
4164,"dear voucher holder, to claim this weeks offer, at your pc please go to http www wtlp co uk text ts cs apply",spam
4165,well if i'm that desperate i'll just call armand again,human
4166,are you at work right now,human
4167,congrats nokia   video camera phone is your call   calls cost  ppm ave call  mins vary from mobiles   close   post bcm  ldn wc n xx,spam
4168,haven't heard anything and he's not answering my texts so i'm guessing he flaked that said the jb is fantastic,human
4169,"mmmmmm i love you,so much, ahmad i can't wait for this year to begin as every second takes me closer to being at your side happy new year, my love",human
4170,pls what's the full name of joke's school cos fees in university of florida seem to actually be lt gt k pls holla back,human
4171,"sorry, i'll call later",human
4172,ok but they said i've got wisdom teeth hidden inside n mayb need   remove,human
4173,and pls pls drink plenty plenty water,human
4174,how are you doing how's the queen are you going for the royal wedding,human
4175,he's in lag that's just the sad part but we keep in touch thanks to skype,human
4176,ok lor then we go tog lor,human
4177,two teams waiting for some players,human
4178,can ì_ send me a copy of da report,human
4179,"swhrt how u dey,hope ur ok, tot about u  day love n miss take care",human
4180,"ok da, i already planned i wil pick you",human
4181,"urgent please call   your abta complimentary   spanish holiday or å£ ,  cash await collection sae t cs box   po   ez  ppm  ",spam
4182,"sorry, i'll call later in meeting",human
4183,i just really need shit before tomorrow and i know you won't be awake before like  ,human
4184,i'm good have you registered to vote,human
4185,"hmm ok, i'll stay for like an hour cos my eye is really sore",human
4186,dear got bus directly to calicut,human
4187,mm umma ask vava also to come tell him can play later together,human
4188,"well the general price is lt gt oz, let me know if when how much you want",human
4189,"sorry, i'll call later",human
4190,"each moment in a day,has its own value morning brings hope,afternoon brings faith,evening brings luv,night brings rest,wish u find them all today good morning",human
4191,lt gt w jetton ave if you forgot,human
4192,ok i'm coming home now,human
4193,can not use foreign stamps in this country,human
4194,"double mins and txts    months free bluetooth on orange available on sony, nokia motorola phones call mobileupd  on   or call optout n dx",spam
4195,"sorry, it's a lot of friend of a friend stuff, i'm just now about to talk to the actual guy who wants to buy",human
4196,free for  st week no  nokia tone   ur mob every week just txt nokia to   get txting and tell ur mates www getzed co uk pobox   w wq norm p tone  ,spam
4197,"want to funk up ur fone with a weekly new tone reply tones u   this text www ringtones co uk, the original n best tones  gbp network operator rates apply",spam
4198,"cmon babe, make me horny, turn me on txt me your fantasy now babe im hot, sticky and need you now all replies cost å£      cancel send stop",spam
4199,i will come tomorrow di,human
4200,wylie update my weed dealer carlos went to freedom and had a class with lunsford,human
4201,are you happy baby are you alright did you take that job i hope your fine i send you a kiss to make you smile from across the sea kiss kiss,human
4202,c movie is juz last minute decision mah juz watch   lar but i tot ì_ not interested,human
4203,how are you enjoying this semester take care brother,human
4204,important information   orange user  xxxxxx today is ur lucky day   find out why log onto http www urawinner com there's a fantastic prizeawaiting you,spam
4205,"get the door, i'm here",human
4206,"lets use it next week, princess",human
4207,or i go home first lar ì_ wait   me lor i put down my stuff first,human
4208,i want kfc its tuesday only buy   meals only   no gravy only   mark  ,human
4209,no da he is stupid da always sending like this don believe any of those message pandy is a mental,human
4210,oi when you gonna ring,human
4211,missed call alert these numbers called but left no message  ,spam
4212,i attended but nothing is there,human
4213,ard   like dat lor we juz meet in mrt station then ì_ dun haf to come out,human
4214,no dear i was sleeping p,human
4215,er mw im filled tuth is aight,human
4216,will be office around   pm now i am going hospital,human
4217,actually i'm waiting for   weeks when they start putting ad,human
4218,anything lor if they all go then i go lor,human
4219,u free on sat rite u wan   watch infernal affairs wif me n darren n mayb xy,human
4220,"plz note if anyone calling from a mobile co amp asks u to type lt gt or lt gt do not do so disconnect the call,coz it iz an attempt of 'terrorist' to make use of the sim card no itz confirmd by nokia n motorola n has been verified by cnn ibn",human
4221,yo you around a friend of mine's lookin to pick up later tonight,human
4222,stupid auto correct on my phone,human
4223,double eviction this week spiral and michael and good riddance to them,human
4224,"\the world suffers a lot not because of the violence of bad people but because of the silence of good people \""",human
4225,"ok thats cool its , just off either raglan rd or edward rd behind the cricket ground gimme ring when ur closeby see you tuesday",human
4226,buy one egg for me da please,human
4227,have you started in skye,human
4228,have you bookedthe hut and also your time off how are you by the way,human
4229,and several to you sir,human
4230,u really pig leh sleep so much my dad wake me up at   smth   eat lunch today,human
4231,i'm at home please call,human
4232,my love i hope your not doing anything drastic don't you dare sell your pc or your phone,human
4233,now only i reached home i am very tired now i will come tomorro,human
4234,freemsg our records indicate you may be entitled to   pounds for the accident you had to claim for free reply with yes to this msg to opt out text stop,spam
4235,"u can win å£  of music gift vouchers every week starting now txt the word draw to   tscs www idew com skillgame,  winaweek, age   ppermesssubscription",spam
4236,life style garments account no please,human
4237,lol wtf random btw is that your lunch break,human
4238,"sez, hows u de arab boy hope u r all good give my love   evry  love ya eshxxxxxxxxxxx",human
4239,"the lay man just to let you know you are missed and thought off do have a great day and if you can send me bimbo and ugo's numbers, ill appreciate safe",human
4240,detroit the home of snow enjoy it,human
4241,show ur colours euro         offer get an england flag  lions tone on ur phone click on the following service message for info,spam
4242,okie,human
4243,"aight, i'm chillin in a friend's room so text me when you're on the way",human
4244,is toshiba portege m  gd,human
4245,well welp is sort of a semiobscure internet thing,human
4246,text pass to   to collect your polyphonic ringtones normal gprs charges apply only enjoy your tones,spam
4247,"accordingly i repeat, just text the word ok on your mobile phone and send",spam
4248,loosu go to hospital de dont let it careless,human
4249,how much for an eighth,human
4250,omg joanna is freaking me out she's looked thru all my friends to find photos of me and then she's asking about stuff on my myspace which i haven't even logged on in like a year,human
4251,"send ur birthdate with month and year, i will tel u ur life partner's name and the method of calculation reply must",human
4252,juz now havent woke up so a bit blur blur can dad went out liao i cant cum now oso,human
4253,"how about clothes, jewelry, and trips",human
4254,block breaker now comes in deluxe format with new features and great graphics from t mobile buy for just å£  by replying get bbdeluxe and take the challenge,spam
4255,aah a cuddle would be lush i'd need lots of tea and soup before any kind of fumbling,human
4256,important information   orange user today is your lucky day  find out why log onto http www urawinner com there's a fantastic surprise awaiting you,spam
4257,i am late i will be there at,human
4258,sad story of a man last week was my b'day my wife did'nt wish me my parents forgot n so did my kids i went to work even my colleagues did not wish,human
4259,are you plans with your family set in stone,human
4260,pls dont forget to study,human
4261,you'll never believe this but i have actually got off at taunton wow,human
4262,"den only weekdays got special price haiz cant eat liao cut nails oso muz wait until i finish drivin wat, lunch still muz eat wat",human
4263,she just broke down a list of reasons why nobody's in town and i can't tell if she's being sarcastic or just faggy,human
4264,lt decimal gt m but its not a common car here so its better to buy from china or asia or if i find it less expensive i ll holla,human
4265,the greatest test of courage on earth is to bear defeat without losing heart gn tc,human
4266,sorry im stil fucked after last nite went tobed at   got up   work at  ,human
4267,hey so whats the plan this sat,human
4268,beauty sleep can help ur pimples too,human
4269,great hope you are using your connections from mode men also cos you can never know why old friends can lead you to today,human
4270,natalja   f is inviting you to be her friend reply yes   or no   see her www sms ac u nat  stop send stop frnd to  ,spam
4271,where to get those,human
4272,"kind of just missed train cos of asthma attack, nxt one in half hr so driving in not sure where to park",human
4273,ball is moving a lot will spin in last so very difficult to bat,human
4274,haiyoh maybe your hamster was jealous of million,human
4275,can you please send me my aunty's number,human
4276,i'm glad you are following your dreams,human
4277,i've reached home finally,human
4278,"urgent important information for   user today is your lucky day   find out why , log onto http www urawinner com there is a fantastic surprise awaiting you",spam
4279,winner as a valued network customer you have been selected to receivea å£  prize reward to claim call   claim code kl  valid   hours only,spam
4280,"wn u r hurt by d prsn who s close   u, do fight wit dem coz somtimes dis fight saves a relation bt being quiet leaves nothin in a relation gud eveb",human
4281,u can call now,human
4282,"science tells that chocolate will melt under the sunlight please don't walk under the sunlight bcoz,i don't want to loss a sweet friend",human
4283,yes i come to nyc for audiitions and am trying to relocate,human
4284,i pocked you up there before,human
4285,congrats that's great i wanted to tell you not to tell me your score cos it might make me relax but its motivating me so thanks for sharing,human
4286,i wud never mind if u dont miss me or if u dont need me but u wil really hurt me wen u need me amp u dont tell me take care,human
4287,hey mr whats the name of that bill brison book the one about language and words,human
4288,"okay, good, no problem, and thanx",human
4289,"for you information, ikea is spelled with all caps that is not yelling when you thought i had left you, you were sitting on the bed among the mess when i came in i said we were going after you got home from class please don't try and bullshit me it makes me want to listen to you less",human
4290,call me when u're done,human
4291,g w r,human
4292,you best watch what you say cause i get drunk as a motherfucker,human
4293,kit strip you have been billed  p netcollex ltd po box   ig  oja,spam
4294,hmv bonus special   pounds of genuine hmv vouchers to be won just answer   easy questions play now send hmv to   more info www  percent real com,spam
4295,please call   immediately as there is an urgent message waiting for you,spam
4296,thesmszone com lets you send free anonymous and masked messages im sending this message from there do you see the potential for abuse,spam
4297,"well done your   costa del sol holiday or å£  await collection call   now toclaim sae, tcs, pobox , stockport, sk xh, costå£    pm, max mins",spam
4298,hurt me tease me make me cry but in the end of my life when i die plz keep one rose on my grave and say stupid i miss u have a nice day bslvyl,human
4299,"erm woodland avenue somewhere do you get the parish magazine, his telephone number will be in there",human
4300,are there ta jobs available let me know please cos i really need to start working,human
4301,aiyar hard   type u later free then tell me then i call n scold n tell u,human
4302,yup i'm free,human
4303,"good good, billy mates all gone just been jogging, again did enjoy concert",human
4304,yo come over carlos will be here soon,human
4305,awww dat is sweet we can think of something to do he he have a nice time tonight ill probably txt u later cos im lonely xxx,human
4306,i guess it is useless calling u   something important,human
4307,ha ha had popped down to the loo when you hello ed me hello,human
4308,he dint tell anything he is angry on me that why you told to abi,human
4309,someone u know has asked our dating service   contact you cant guess who call   now all will be revealed po box  m   wu,spam
4310,it so happens that there r  waxsto do wat you want she can come and ill get her medical insurance and she'll be able to deliver and have basic care i'm currently shopping for the right medical insurance for her so just give me til friday morning thats when i ll see the major person that can guide me to the right insurance,human
4311,i keep ten rs in my shelf buy two egg,human
4312,"i wasn't well babe, i have swollen glands at my throat what did you end up doing",human
4313,is ur changes   da report big cos i've already made changes   da previous report,human
4314,captain is in our room,human
4315,"i can't speak, bcaz mobile have problem i can listen you but you cann't listen my voice so i calls you later",human
4316,hiya stu wot u up   im in so much truble at home at moment evone hates me even u wot the hell av i done now y wont u just tell me text bck please luv dan,human
4317,s i will take mokka players only,human
4318,are you still playing with gautham,human
4319,hey mr and i are going to the sea view and having a couple of gays i mean games give me a bell when ya finish,human
4320,"k, jason says he's gonna be around so i'll be up there around lt gt",human
4321,sorry i will be able to get to you see you in the morning,human
4322,aight well keep me informed,human
4323,i am not having her number sir,human
4324,am only searching for good dual sim mobile pa,human
4325,that seems unnecessarily hostile,human
4326,dude got a haircut now its breezy up there,human
4327,"congrats   mobile  g videophones r yours call   now videochat wid ur mates, play java games, dload polyh music, noline rentl bx  ip   we  pm",spam
4328, apple day no doctor  tulsi leaf day no cancer  lemon day no fat  cup milk day no bone problms   litres watr day no diseases snd ths   whom u care,human
4329,i thought we were doing a king of the hill thing there,human
4330,nope i'll come online now,human
4331,also tell him i said happy birthday,human
4332,y bishan lei i tot ì_ say lavender,human
4333,boo what time u get out u were supposed to take me shopping today,human
4334,"now u sound like manky scouse boy steve,like i is travelling on da bus home wot has u inmind   recreation dis eve",human
4335,"fyi i'm taking a quick shower, be at epsilon in like lt gt min",human
4336,on a tuesday night r u   real,human
4337,yes when is the appt again,human
4338,just got outta class gonna go gym,human
4339,i want to sent lt gt mesages today thats y sorry if i hurts,human
4340,ìï all write or wat,human
4341,ha i wouldn't say that i just didn't read anything into way u seemed i don't like   be judgemental i save that for fridays in the pub,human
4342,its a valentine game send dis msg to all ur friends if   answers r d same then someone really loves u ques which colour suits me the best,human
4343,hi did you asked to waheeda fathima about leave,human
4344,enjoy urself tmr,human
4345,you still around i could use a half  th,human
4346,u   have a secret admirer who is looking   make contact with u find out who they r reveal who thinks ur so special call on  ,spam
4347,you give us back my id proof and lt gt rs we wont allow you to work we will come to your home within days,human
4348,ìï bot notes oredi cos i juz rem i got,human
4349,yes rent is very expensive so its the way we save,human
4350,"night has ended for another day, morning has come in a special way may you smile like the sunny rays and leaves your worries at the blue blue bay gud mrng",human
4351,hows the pain dear y r u smiling,human
4352,"fun fact although you would think armand would eventually build up a tolerance or some shit considering how much he smokes, he gets fucked up in like   hits",human
4353,important information   orange user  xxxxxxx today is your lucky day  find out why log onto http www urawinner com there's a fantastic surprise awaiting you,spam
4354,"sorry, i can't help you on this",human
4355,great so should i send you my account number,human
4356,"hellogorgeous, hows u my fone was on charge lst nitw wen u texd me hopeu ad a nice wkend as im sure u did lookin  ward   c in u  mrw luv jaz",human
4357,"our dating service has been asked   contact u by someone shy call   now all will be revealed pobox , m   uz  p",spam
4358,ìï only send me the contents page,human
4359,"night sweet, sleep well i've just been to see the exorcism of emily rose and may never sleep again hugs and snogs",human
4360,"don't think about \what u have got\"" think about \""how to use it that you have got\"" good ni """,human
4361,"i can't right this second, gotta hit people up first",human
4362,"evry emotion dsn't hav words evry wish dsn't hav prayrs if u smile,d world is wit u othrwise even d drop of tear dsn't lik   stay wit u so b happy good morning, keep smiling",human
4363,so what about you what do you remember,human
4364,ujhhhhhhh computer shipped out with address to sandiago and parantella lane wtf poop,human
4365,mm yes dear look how i am hugging you both p,human
4366,i like dis sweater fr mango but no more my size already so irritating,human
4367,  i don't have her number and   its gonna be a massive pain in the ass and i'd rather not get involved if that's possible,human
4368,anytime lor,human
4369,do you want a new video handset   any time any network mins unlimited text camcorder reply or call now   for del sat am,spam
4370,purity of friendship between two is not about smiling after reading the forwarded message its about smiling just by seeing the name gud evng,human
4371,"ur balance is now å£  next question complete the landmark, big, a bob, b barry or c ben text a, b or c to   good luck",spam
4372,me fine absolutly fine,human
4373,k and you're sure i don't have to have consent forms to do it v,human
4374,ur tonexs subscription has been renewed and you have been charged å£    you can choose   more polys this month www clubzed co uk billing msg,spam
4375,"if you don't, your prize will go to another customer t c at www t c biz    p min polo ltd suite   london w j  hl please call back if busy",spam
4376,how much is torch in  ja,human
4377,"doing nothing, then u not having dinner w us",human
4378,how are you just checking up on you,human
4379,done it but internet connection v slow and canû÷t send it will try again later or first thing tomo,human
4380,mathews or tait or edwards or anderson,human
4381,yeah sure thing mate haunt got all my stuff sorted but im going sound anyway promoting hex for by the way who is this dont know number joke,human
4382,no need lar i go engin cos my sis at arts today,human
4383,thanks honey but still haven't heard anything i will leave it a bit longer so not   crowd him and will try later great advice thanks hope cardiff is still there,human
4384,do you want a new nokia  i colour phone delivered tomorrow with   free minutes to any mobile   free text free camcorder reply or call  ,spam
4385,", im on the snowboarding trip i was wondering if your planning to get everyone together befor we go a meet and greet kind of affair cheers,",human
4386,s i'm watching it in live,human
4387,"see you then, we're all christmassy here",human
4388,"k i'm ready, lt gt",human
4389,"do you know why god created gap between your fingers so that, one who is made for you comes amp fills those gaps by holding your hand with love",human
4390,the greatest test of courage on earth is to bear defeat without losing heart gn tc,human
4391,what are your new years plans,human
4392,recpt     you have ordered a ringtone your order is being processed,spam
4393,baaaaaaaabe wake up i miss you i crave you i need you,human
4394,"only just got this message, not ignoring you yes, i was shopping that is",human
4395,dear why you mood off i cant drive so i brother to drive,human
4396,when did dad get back,human
4397,"can you tell shola to please go to college of medicine and visit the academic department, tell the academic secretary what the current situation is and ask if she can transfer there she should ask someone to check sagamu for the same thing and lautech its vital she completes her medical education in nigeria its less expensive much less expensive unless she will be getting citizen rates in new zealand",human
4398,yes just finished watching days of our lives i love it,human
4399,juz go google n search   qet,human
4400,many times we lose our best ones bcoz we are,human
4401,"good friends care for each other close friends understand each other and true friends stay forever beyond words, beyond time gud ni ",human
4402,just getting back home,human
4403,"sorry, i'll call later lt gt mins",human
4404,dun need to use dial up juz open da browser n surf,human
4405,as one of our registered subscribers u can enter the draw   a   g b gift voucher by replying with enter to unsubscribe text stop,spam
4406,"awesome, plan to get here any time after like lt gt , i'll text you details in a wee bit",human
4407,take care and sleep well you need to learn to change in life you only need to get convinced on that i will wait but no more conversations between us get convinced by that time your family is over for you in many senses respect them but not overemphasise or u have no role in my life,human
4408,"for your chance to win a free bluetooth headset then simply reply back with \adp\""""",spam
4409,you also didnt get na hi hi hi hi hi,human
4410,ya but it cant display internal subs so i gotta extract them,human
4411,if i said anything wrong sorry de,human
4412,sad story of a man last week was my b'day my wife did'nt wish me my parents forgot n so did my kids i went to work even my colleagues did not wish,human
4413,how stupid to say that i challenge god you dont think at all on what i write instead you respond immed,human
4414,"yeah i should be able to, i'll text you when i'm ready to meet up",human
4415,v skint too but fancied few bevies waz gona go meet othrs in spoon but jst bin watchng planet earth sofa is v comfey if i dont make it hav gd night,human
